{
  "$schema": "http://json-schema.org/draft-07/schema#",
  "title": "DataManifest",
  "type": "object",
  "required": [
    "generated_at",
    "total_files",
    "files",
    "environment"
  ],
  "properties": {
    "generated_at": {
      "type": "string"
    },
    "total_files": {
      "type": "integer"
    },
    "environment": {
      "type": "object",
      "required": [
        "python_version",
        "random_seed"
      ],
      "properties": {
        "python_version": {
          "type": "string"
        },
        "random_seed": {
          "type": "integer"
        }
      }
    },
    "files": {
      "type": "array",
      "items": {
        "type": "object",
        "required": [
          "file",
          "type",
          "size_bytes",
          "sha256",
          "status"
        ],
        "properties": {
          "file": {
            "type": "string"
          },
          "type": {
            "type": "string"
          },
          "size_bytes": {
            "type": "integer"
          },
          "sha256": {
            "type": "string"
          },
          "status": {
            "type": "string"
          }
        }
      }
    }
  }
}